text,intent,id
do a british male accent only,change_accent,train-7230
is it possible to make an order for more checkbooks for my chase bank account,order_checks,train-7231
"my phone was too close to my card and demagnetized it, how can i report this",damaged_card,train-7232
i need to go back on my factory settings,reset_settings,train-7233
could you tell me what timezone reno is in,timezone,train-7234
what time is it getting to be,time,train-7235
what is 90908 divided by 30890,calculator,train-7236
what do i need to do to look up my 1st republic account's interest rate,interest_rate,train-7237
how long does it take tomatoes to expire,food_last,train-7238
i need ten dollars sent from b of a to washington mutual,transfer,train-7239
the bank should know i am going to asia soon,travel_notification,train-7240
book an oil change please,schedule_maintenance,train-7241
my friend steve needs my gps coordinates send them to him,share_location,train-7242
what is the current time in mexico city,time,train-7243
list the steps for applying for an american express card,new_card,train-7244
how long is the ride to phoenix,distance,train-7245
reserve a table for two for 7:30 pm at dibruno's under patrick donoghue,restaurant_reservation,train-7246
how many vacation days do i still get,pto_balance,train-7247
i'd like to know this song's name,what_song,train-7248
how do i get to the hotel by bus,directions,train-7249
can you tell me your name,what_is_your_name,train-7250
i appreciate it,thank_you,train-7251
"cross out bananas from my shopping list and put papayas on it, please",shopping_list_update,train-7252
message mom where are you,text,train-7253
how many of my vacation days do i have remaining,pto_balance,train-7254
i need a reminder to remind me to do something,reminder_update,train-7255
tell me how the weather is,weather,train-7256
turn the volume to level 4,change_volume,train-7257
can you please cancel,cancel,train-7258
"book a flight from miami, fl to columbus, ga on 16 february 2019 and returning on 2 march 2019",book_flight,train-7259
what do i do if i think my car battery's dead,jump_start,train-7260
where did your parents have you,where_are_you_from,train-7261
can you let me listen to elvis,play_music,train-7262
is my order due yet,order_status,train-7263
do you know what things i wanted to remember,reminder,train-7264
tell me how to utilize my card points,redeem_rewards,train-7265
find me a good spot for southern comfort food in los angeles,restaurant_suggestion,train-7266
how long has it been since my car was in the shop,last_maintenance,train-7267
how long should i cook the steak for,cook_time,train-7268
tell me five dollars in yen and rubles,exchange_rate,train-7269
give me all contents of my shopping list,shopping_list,train-7270
are you real or automated,are_you_a_bot,train-7271
i need to know how to change my insurance,insurance_change,train-7272
that is affirmative,yes,train-7273
add corn to my shopping list and remove wine,shopping_list_update,train-7274
can i call a restaurant,make_call,train-7275
how clogged are the streets before the stadium,traffic,train-7276
please call me jim,change_user_name,train-7277
"find and book a hotel in md, baltimore starting on the 7th to the 9th",book_hotel,train-7278
what's the name of my medical coverage,insurance,train-7279
can you tell me what my currnet salary is,income,train-7280
please dial christie's number,make_call,train-7281
how long until i reach my destination,distance,train-7282
what questions are permissible,what_can_i_ask_you,train-7283
share some information about your pets with me,do_you_have_pets,train-7284
how does yelp report the enchiladas are at jose's taco shop,restaurant_reviews,train-7285
"play the song with the lyrics, ""baby shark, doo doo",play_music,train-7286
what should i do with an unusable and damaged card,damaged_card,train-7287
do i need more air in my tires,tire_pressure,train-7288
how many carry ons are allowed on a flight with wow to iceland,carry_on,train-7289
please provide an option for dinner,meal_suggestion,train-7290
take me to the next song on this playlist,next_song,train-7291
how long should this be in the oven,cook_time,train-7292
how much interest am i getting on my savings,interest_rate,train-7293
i need you to skip this song and play the next one,next_song,train-7294
i'd like to order more checks for my savings account,order_checks,train-7295
i want you to roll dice,roll_dice,train-7296
i need an uber that will accommodate eight people to go to the closest amc theater,uber,train-7297
does longhorn steakhouse have good reviews,restaurant_reviews,train-7298
play the next hit,next_song,train-7299
immediately call tom,make_call,train-7300
do heads or tails,flip_coin,train-7301
increase volume to 4,change_volume,train-7302
i'll pass,no,train-7303
exactly right,yes,train-7304
you are wrong,no,train-7305
i'm out of lysol could you order me some,order,train-7306
abandon the dinner reservation i made,cancel_reservation,train-7307
what do i have to pay on my amex that is the minimum,min_payment,train-7308
how much gas is left,gas,train-7309
what's ten times eight,calculator,train-7310
how do you like to spend your free time,what_are_your_hobbies,train-7311
"please roll the dice, ai",roll_dice,train-7312
how long ago were you born,how_old_are_you,train-7313
i am hoping to switch insurance plans,insurance_change,train-7314
how many gallons do i have left,gas,train-7315
please set up an alarm to go off tomorrow at daybreak,alarm,train-7316
check if there's a hotel room that can receive 10 people in tampa from this friday for a week,book_hotel,train-7317
the language i am using will now be italian,change_language,train-7318
take everything off my todo list,todo_list_update,train-7319
tell my bank i will be travelling to the caribbean,travel_notification,train-7320
change your name to something funny,change_ai_name,train-7321
what is the smallest payment i can make toward my xfinity bill,min_payment,train-7322
where were you made,where_are_you_from,train-7323
can you tell me who made the ai,who_made_you,train-7324
that is not false,yes,train-7325
what is on my calander for valentines day,calendar,train-7326
at how many miles am i required to get my oil changed,oil_change_when,train-7327
please flip a coin i select tails,flip_coin,train-7328
can i refer to you as mike from here on out,change_ai_name,train-7329
how long should a cake bake,cook_time,train-7330
apply for a kbc card for me,new_card,train-7331
how do i adjust my insurance policy,insurance_change,train-7332
what ingredients do i need to make egg salad,ingredients_list,train-7333
how many days can i slack off this year,pto_balance,train-7334
i can't make up my mind,maybe,train-7335
can you give me a vietnamese dinner suggestion,meal_suggestion,train-7336
what will be the date in 100 days from now,date,train-7337
tell me the date 650 days from now,date,train-7338
what's a good trivia fact about china,fun_fact,train-7339
is the pressure in my tires optimal,tire_pressure,train-7340
"i would like to change the pin on my savings account, please",pin_change,train-7341
ai please repeat,repeat,train-7342
"on my to do list, add exercising",todo_list_update,train-7343
what's my bill going to be for my taxes for tennessee,taxes,train-7344
could you check to see if my order has been delivered,order_status,train-7345
please give me the minimum payment total for my sprint phone bill,min_payment,train-7346
what time do i have to pay z bill,bill_due,train-7347
ways to transfer my 401k,rollover_401k,train-7348
text robby hello,text,train-7349
i would like to share my location with my mom,share_location,train-7350
i need help finding my mobile phone,find_phone,train-7351
when do i need to pay my at&t bill,bill_due,train-7352
what's td bank's interest rate,interest_rate,train-7353
i would like to replace the pin number for my retirement account,pin_change,train-7354
please order me everything that is on my shopping list,order,train-7355
can you get my car started,smart_home,train-7356
show me how to schedule a meeting,schedule_meeting,train-7357
i want you to speak more slowly to me,change_speed,train-7358
how do you make chicken noodle casserole,ingredients_list,train-7359
what is today,date,train-7360
how long can i keep pizza in the freezer for before it goes bad,food_last,train-7361
before i leave for mexico should i get some more vaccinations,vaccines,train-7362
set my paycheck up for direct deposit,direct_deposit,train-7363
clear my calendar for tomorrow,calendar_update,train-7364
please go to factory settings now,reset_settings,train-7365
"what's the current time, please",time,train-7366
i just found a better job and need to move my 401k over to my new employer,rollover_401k,train-7367
give the boys my location please,share_location,train-7368
deposit ten bucks from my chase account to my ally account,transfer,train-7369
schedule me a table for 2 at red lobster at 8,restaurant_reservation,train-7370
how do i change the name you use to address me,change_user_name,train-7371
does chic-fil-a have good reviews,restaurant_reviews,train-7372
"please stop calling me dave, my name's bob",change_user_name,train-7373
when did i take my car to paul's auto last,last_maintenance,train-7374
"i put in a credit card application, so what is the status with it currently",application_status,train-7375
i wanna know the bill's minimum payment,min_payment,train-7376
what date is my at&t bill due,bill_due,train-7377
if i got to indonesia is it safe,travel_alert,train-7378
do you know the fuel economy of this car,mpg,train-7379
how much pto have i accrued,pto_balance,train-7380
i think someone's using my visa card without my permission,report_fraud,train-7381
please tell wanda where i am now,share_location,train-7382
please tell me if a coin lands on tails,flip_coin,train-7383
will i need immunization for a trip to turkey,vaccines,train-7384
i must order some more checks for my checking account,order_checks,train-7385
what organization do you work for,who_do_you_work_for,train-7386
please link up to my phone,sync_device,train-7387
can you provide information on my income,income,train-7388
tell me some amazing trivia about radios,fun_fact,train-7389
what kind of oil do i need to get and use for my car,oil_change_how,train-7390
create a link with my phone,sync_device,train-7391
tell me how many vacation days i've used,pto_used,train-7392
please tell me the status of my last online order from walmart,order_status,train-7393
is traffic bad on the way to chicago,traffic,train-7394
at what point should the oil be changed again,oil_change_when,train-7395
i'd like you to give me an idea for a meal from iceland,meal_suggestion,train-7396
do they take reservations at arby's,accept_reservations,train-7397
when's the next federally recognized holiday,next_holiday,train-7398
i want to request pto from november 7 to 11,pto_request,train-7399
how much did i spend last week,spending_history,train-7400
what are some tourist sites to see in ann arbor,travel_suggestion,train-7401
i want to book a hotel room for 10 people from monday to tuesday in manhattan,book_hotel,train-7402
update me on my delta flight please,flight_status,train-7403
take $40 from account a and transfer it to account b,transfer,train-7404
how's it going right now,greeting,train-7405
when was my last payday,payday,train-7406
let me know where i'm located,current_location,train-7407
suggest a meal from korea to me,meal_suggestion,train-7408
provide a random roll of the dice,roll_dice,train-7409
i need instructions on how to change my car's oil and what type i should buy,oil_change_how,train-7410
go ahead and say all of the points on my list of to-do's please,todo_list,train-7411
"at which mileage, should i get my oil changed",oil_change_when,train-7412
what is the total amount that i have spent on the cash app for this month so far,spending_history,train-7413
please speak slower,change_speed,train-7414
can you tell me the calories for the cheeseburger,calories,train-7415
would you let me know if you are a cat or dog person,do_you_have_pets,train-7416
did my american express card application go through yet,application_status,train-7417
what are you hobbies,what_are_your_hobbies,train-7418
if i were english how would i say subway,translate,train-7419
please make sure the volume is on 4,change_volume,train-7420
i wanna know the limit on my credit card,credit_limit,train-7421
i need you to help me with some math if you can,calculator,train-7422
how much will i pay in state taxes,taxes,train-7423
send fraudulent activity information,report_fraud,train-7424
i'm traveling between denver and la so tell my bank,travel_notification,train-7425
do i need a socket converter if i'm going to be in sweden,plug_type,train-7426
what is the exact number of my salary,income,train-7427
i want your language changed to chinese,change_language,train-7428
we no longer need fries on the shopping lisr,shopping_list_update,train-7429
do you know any fun facts about mt everest,fun_fact,train-7430
does carrying a balance hurt my credit score,improve_credit_score,train-7431
delete lunch with steve on friday please,calendar_update,train-7432
when did my oil last get changed,last_maintenance,train-7433
"in brooklyn, i need a hotel room for 4 from 3/15 until 3/20",book_hotel,train-7434
what is the status of my most recent order,order_status,train-7435
look into the status of the credit card application i submitted recently for my new card,application_status,train-7436
can you tell me if my application for a credit card has been processed yet it was at chase bank,application_status,train-7437
how many calories are in chocolate ice cream,calories,train-7438
what apr do i have with my credit card,apr,train-7439
are you actually a bot,are_you_a_bot,train-7440
i need you to set an alarm for 8am tomorrow,alarm,train-7441
is it possible to get a credit limit increase to 3000,credit_limit_change,train-7442
tell me straight if it has been processed or not,application_status,train-7443
i want to pay my car bill,pay_bill,train-7444
i want to schedule somewhere get my tires checked out,schedule_maintenance,train-7445
when did my car get serviced last,last_maintenance,train-7446
my card isn't working,damaged_card,train-7447
check my calendar for the date that my care was last serviced,last_maintenance,train-7448
i wanna know what is currently on my calendar for friday the 1st,calendar,train-7449
how do i put in a pto request for the first to the ninth,pto_request,train-7450
"what is your age, ai",how_old_are_you,train-7451
have i been spending a lot on alcohol lately,spending_history,train-7452
how high is my credit limit for my old navy card,credit_limit,train-7453
what sort of animals are your pets,do_you_have_pets,train-7454
what do i have to do on january 1st,calendar,train-7455
how much did i spend shopping for clothes today,spending_history,train-7456
how's the lo mein rated at hun lee's,restaurant_reviews,train-7457
you must increase your volume,change_volume,train-7458
could you help me out with a new renters' insurance plan,insurance_change,train-7459
i submitted my order is there any updates on it yet,order_status,train-7460
will my 401k rollover or not,rollover_401k,train-7461
is the apr rate on my amex pretty good,apr,train-7462
can you tell me what the next day is,date,train-7463
change to whisper mode,whisper_mode,train-7464
look to see if my application for the barclay's card has gone through yet,application_status,train-7465
can i increase the credit limit for my usaa card,credit_limit_change,train-7466
how many days will it take to get a new credit card to replace the one stolen from me,replacement_card_duration,train-7467
i would like to know who programmed this ai,who_made_you,train-7468
i need to thank you,thank_you,train-7469
where do i find the routing number for sunflower bank,routing,train-7470
please repeat,repeat,train-7471
let me know if you are a human or a computer,are_you_a_bot,train-7472
please erase everything on my to do list,todo_list_update,train-7473
how long will i wait for a table at red lobster,how_busy,train-7474
is it possible for you to whisper for me,whisper_mode,train-7475
what mexican restaurant within 5 miles has the best reviews,restaurant_suggestion,train-7476
how much can i expect on my next check,income,train-7477
how is my application on new credit card going,application_status,train-7478
tel me the credit limit for my credit card,credit_limit,train-7479
what all do i have on my shopping list,shopping_list,train-7480
i need you to confirm my reservation for tomorrow at 3 pm,confirm_reservation,train-7481
are you a real person or software,are_you_a_bot,train-7482
would you say i need new tires if i last bought them on the 24th,tire_change,train-7483
tell me what is owed for my water and gas bills,bill_balance,train-7484
use my park bank account to pay my electric bill,pay_bill,train-7485
i think not,no,train-7486
are the donuts at tgi well reviewed,restaurant_reviews,train-7487
"ai, go ahead and roll the dice",roll_dice,train-7488
play help! by the beatles,play_music,train-7489
what's the status of my gas tank,gas,train-7490
i'm drawing a blank,maybe,train-7491
set a reminder to go dress shopping,reminder_update,train-7492
can you check and see if my credit card application has been approved or not,application_status,train-7493
has my application for a trust bank credit card been mailed out and if so was i approved or not,application_status,train-7494
what gas is needed for the car,gas_type,train-7495
can you let me know if it will be warm this week,weather,train-7496
find a suitable lodging in vancouver on march 16-19,book_hotel,train-7497
what do i need to cook chicken soup,ingredients_list,train-7498
please unreserve that table,cancel_reservation,train-7499
how can i order more checks since i do not have any more,order_checks,train-7500
do you know what you call me,user_name,train-7501
i got to remove fishing from my calendar for soccer,calendar_update,train-7502
what amount of gas do i have in my car,gas,train-7503
i am in need of a switch to my insurance plan,insurance_change,train-7504
do they take reservations at state bird,accept_reservations,train-7505
what's life's meaning,meaning_of_life,train-7506
provide the name i should use to refer to you,what_is_your_name,train-7507
how do i go about resolving my luggage that didn't arrive,lost_luggage,train-7508
it was really nice to be able to chat with you,goodbye,train-7509
i lost my phone and need help retrieving it,find_phone,train-7510
i need a vegi lasagna recipe,recipe,train-7511
tell me about my income this week,income,train-7512
fairwell,goodbye,train-7513
what is the scheduled landing time for my flight,flight_status,train-7514
can you walk me through setting up direct deposits to my bank of internet savings account,direct_deposit,train-7515
please help me find my cellphone,find_phone,train-7516
do i need any vaccinations before going to indonesia,vaccines,train-7517
what company sponsored you,who_made_you,train-7518
can you book me a hotel in los angeles near commerce casino from april 1st to the 5th,book_hotel,train-7519
6 sided dice roll,roll_dice,train-7520
"can you tell me how to change my car's oil, and what type i need to buy",oil_change_how,train-7521
i need to know the date in 256 days,date,train-7522
roll 6 sided die,roll_dice,train-7523
where are we located,current_location,train-7524
who was your creator,who_made_you,train-7525
create an alarm for 9 am and another one for 11 am,alarm,train-7526
what is my credit card interest rate,interest_rate,train-7527
"ai, please stop your current task",cancel,train-7528
i want to change my pin number for my checking account,pin_change,train-7529
flip it please,flip_coin,train-7530
what is your current income,income,train-7531
i need you to use your whisper voice,whisper_mode,train-7532
how do i share my location with noel,share_location,train-7533
how many times can 12 go into 600,calculator,train-7534
how much did i earn in income only last year,income,train-7535
i go by brad,change_user_name,train-7536
help me figure out when exactly my credit card will be expiring,expiration_date,train-7537
i need to remove an event from my calendar,calendar_update,train-7538
what does altruism mean,definition,train-7539
i want to practive changing oil,oil_change_how,train-7540
i want to know the weather forecast for today,weather,train-7541
what are the rules for carry on luggage for delta,carry_on,train-7542
why on earth would a block have been placed on my account,account_blocked,train-7543
what do you think you will refer to me as,user_name,train-7544
give my my current points on my marriot rewards card,rewards_balance,train-7545
my luggage is missing i was on american airlines flight ab123 out of dallas,lost_luggage,train-7546
how can i change my oil for my car,oil_change_how,train-7547
how long does it take to get to the sky harbor airport,distance,train-7548
what do i currently pay in taxes,taxes,train-7549
i need to book a car rental in boston,car_rental,train-7550
what kind of plug type do they use in russia,plug_type,train-7551
would you reset your factory settings,reset_settings,train-7552
switch over to the female voice,change_accent,train-7553
can you text marissa and tell them to stop calling me,text,train-7554
can you assist me rolling over a 401k for a new job,rollover_401k,train-7555
give my current location to robyn now,share_location,train-7556
can you let me know my credit card's apr,apr,train-7557
is my savings interest rate too high,interest_rate,train-7558
i need to pay my mortgage,pay_bill,train-7559
could you help with booking a car rental for me in seattle,car_rental,train-7560
"if you were to call a place your beginning, your home start, where would that be",where_are_you_from,train-7561
what time is it in tokyo,time,train-7562
what kind of questions do you accept,what_can_i_ask_you,train-7563
what is status of my bank account,balance,train-7564
should i air up the tires,tire_pressure,train-7565
where do i find instructions on how to speed up voice replies,change_speed,train-7566
i don't know for sure,maybe,train-7567
what's my health plan,insurance,train-7568
how low is my gas tank,gas,train-7569
how long should i cook the asparagus for,cook_time,train-7570
what is the total number of vacation days i've used,pto_used,train-7571
tell me something funny about cats,tell_joke,train-7572
can you help me booked a car in london,car_rental,train-7573
"tell me what things i need to accomplish per my to do list, please",todo_list,train-7574
let's whisper,whisper_mode,train-7575
i want to use the female voice now,change_accent,train-7576
on what day is my meeting with dr lee,meeting_schedule,train-7577
can you provide me my credit score,credit_score,train-7578
i can't find my mastercard and i want to report it as lost,report_lost_card,train-7579
find out what my water bill costs please,bill_balance,train-7580
quit the current action please,cancel,train-7581
my card was damaged by my cat; can i report that,damaged_card,train-7582
can you verify my reservation under steve for friendly's,confirm_reservation,train-7583
can you let me know what health plan i'm on,insurance,train-7584
what sort of things do people do in new york,travel_suggestion,train-7585
want 5 minute timer,timer,train-7586
cancel the reservation at olive garden for tommy,cancel_reservation,train-7587
what do i do to get cach back for points on my discover card,redeem_rewards,train-7588
what are some things you like doing,what_are_your_hobbies,train-7589
what's the timeline on replacing a stolen credit card,replacement_card_duration,train-7590
delete my golf tournament event from tomrrow,calendar_update,train-7591
the reservation i made is not required anymore,cancel_reservation,train-7592
"where is the closest walmart to boise, idaho",directions,train-7593
i need to order new checks,order_checks,train-7594
i need my credit score,credit_score,train-7595
call robby for me,make_call,train-7596
i need for you to tell me what is on my shopping list,shopping_list,train-7597
coin flip,flip_coin,train-7598
would you say that you know who your boss is,who_do_you_work_for,train-7599
what's the current time in est,time,train-7600
what is that noise,what_song,train-7601
"if im in japan, what time zone am i in",timezone,train-7602
i need an uber to the sears tower,uber,train-7603
use the whisper voice,whisper_mode,train-7604
please read all the items on my reminder list,reminder,train-7605
do you know what timezone italy is in,timezone,train-7606
do i need any shots before i go to south africa,vaccines,train-7607
i need to know what this song is called,what_song,train-7608
list some neat stuff about rats,fun_fact,train-7609
how many dollars can i exchange for 10 yen,exchange_rate,train-7610
"track package, please",order_status,train-7611
is my bill due this week,bill_due,train-7612
how healthy is grilled chicken,nutrition_info,train-7613
i need new dinner ideas,meal_suggestion,train-7614
i don't want this phone synced any more,sync_device,train-7615
do you know where my w-2 is,w2,train-7616
"can i make a reservation for 2 at state bird for 8:30, please",restaurant_reservation,train-7617
who supplied your instructions,who_made_you,train-7618
can you confirm my reservation for dave at outback steakhouse,confirm_reservation,train-7619
requesting money transfer between accounts,transfer,train-7620
is it raining in sparks,weather,train-7621
i need an alarm set for 10:00 and another set for 3:00,alarm,train-7622
whats the next day that i am off,next_holiday,train-7623
roll a 6 sided die,roll_dice,train-7624
what is inches in centimeters,measurement_conversion,train-7625
how much is my income going to be this month,income,train-7626
can you add passionfruit by yaeji to my playlist,update_playlist,train-7627
please refrain from carrying out the current task,cancel,train-7628
