text,intent,id
i need you to book me a flight from ft lauderdale to houston on southwest,book_flight,train-0
my check engine light is on and i need to take a look at it,schedule_maintenance,train-1
is the company party on my list of reminders,reminder,train-2
are you a human,are_you_a_bot,train-3
i need to do cleaning so add it to my to do list,todo_list_update,train-4
how do i change my oil and what kind do i need,oil_change_how,train-5
how healthy are french fries,nutrition_info,train-6
i'd like to have everything on my shopping list,order,train-7
what type of plugs are used in cambodia,plug_type,train-8
say trivia about lebron james,fun_fact,train-9
speak in a woman's voice,change_accent,train-10
can you please start my car,smart_home,train-11
please set an alarm for mid day,alarm,train-12
i need someone to look at my car and tell me why the light is on,schedule_maintenance,train-13
share my location with ben and jerry,share_location,train-14
tell lydia and laura where i am located,share_location,train-15
what is latin for i love you,translate,train-16
what is the name of the insurance plan that i'm enrolled in,insurance,train-17
whereabouts are you from,where_are_you_from,train-18
what's the deal with my health care,insurance,train-19
what is the tax amount,taxes,train-20
do i need to get vaccinated to go to thailand,vaccines,train-21
how much time have i taken off this year,pto_used,train-22
what is that tax form that shows my wages and where do i get it,w2,train-23
i have to send a text,text,train-24
what is the average wait time at the cheese cake factory,how_busy,train-25
what's my pay,income,train-26
i think my account is block but i am not sure why,account_blocked,train-27
how many personal days have i taken,pto_used,train-28
tell me how long i will need to spend preparing a meat loaf dish,cook_time,train-29
i would like to set up direct deposit,direct_deposit,train-30
how much longer till the next day off,next_holiday,train-31
how much is my gas bill,bill_balance,train-32
flip a coin heads or tails,flip_coin,train-33
i need a recipe on how to make beef stew,recipe,train-34
how cold will it be tomorrow,weather,train-35
can i substitute ginger for garlic,ingredient_substitution,train-36
flip that coin now,flip_coin,train-37
"ai, where do i go to order checks for my usbank account",order_checks,train-38
what time do you have on your watch,time,train-39
just call me al,change_user_name,train-40
have an alarm set for three in the morning,alarm,train-41
when's the last time i got a paycheck,payday,train-42
how many hours will it take to get to my destination,distance,train-43
i need you to flip a coin so i can decide,flip_coin,train-44
please give me today's date,date,train-45
so i made a fraudulent transaction,report_fraud,train-46
let me know the rules for carry ons for continental,carry_on,train-47
do you know my credit score,credit_score,train-48
what types of things do you like to do in your spare time,what_are_your_hobbies,train-49
i need to know the things on my shopping list,shopping_list,train-50
my gps coordiantes will be shared with aunt sunny,share_location,train-51
what's up,greeting,train-52
how do i get to the college by bus,directions,train-53
what interest rate will regions give me,interest_rate,train-54
can you let my bank know i'll be in uruguay from january to august,travel_notification,train-55
are there any specific shots i should get before traveling to england,vaccines,train-56
does japan have any travel alerts i should be aware of,travel_alert,train-57
i'd like a new life insurance plan,insurance_change,train-58
do i have any meetings today between 8 and 9,meeting_schedule,train-59
what is 213 times 3,calculator,train-60
when do i need to get an oil change,oil_change_when,train-61
play the next track,next_song,train-62
what day is it tomorrow,date,train-63
what's the status of my united flight,flight_status,train-64
go back to initial factory state,reset_settings,train-65
do i have any personal days left,pto_balance,train-66
i really don't know,maybe,train-67
i want to make sure my reservation for 5 at mcdonalds is still set,confirm_reservation,train-68
what were my purchases on visa card last month,transactions,train-69
who plays this song,what_song,train-70
return it back to the original settings,reset_settings,train-71
"can you schedule a meeting with jessica at the office, please",schedule_meeting,train-72
exactly what does altruism mean,definition,train-73
"how much can i spend, at most, on my chase freedom",credit_limit,train-74
"yes, that is accurate",yes,train-75
are there any travel alerts in that region,travel_alert,train-76
i want you to make me a pto request for me for april twenty through may two,pto_request,train-77
what sorts of subjects do you know about,what_can_i_ask_you,train-78
i'd like to make a vacation request,pto_request,train-79
i need you to flip a coin once,flip_coin,train-80
how many calories do cheetos have,calories,train-81
what day is my car insurance due,bill_due,train-82
please include laundry on my to do list,todo_list_update,train-83
what meetings do i have today,meeting_schedule,train-84
how do i go about setting up direct deposit,direct_deposit,train-85
where can i look up x's routing number,routing,train-86
no way,no,train-87
you need to set the timer for me,timer,train-88
do i need a visa to get into canada later this year,international_visa,train-89
please change the pin on my bank of america account to be 1234,pin_change,train-90
why would the bank have frozen my account,account_blocked,train-91
how is my calendar looking for may 6th,calendar,train-92
use a woman's voice,change_accent,train-93
can you tell me if eating at outback's any good,restaurant_reviews,train-94
send my location to ben and jerry,share_location,train-95
can you tell me the definition of sucrose,definition,train-96
my credit score is,credit_score,train-97
when did i most recently have my car in the shop,last_maintenance,train-98
please make a pto request for dates tomorrow to the twentieth,pto_request,train-99
assist me by setting my alarm for 9:00 and another for 11:00,alarm,train-100
i'm calling you rupert from now on,change_ai_name,train-101
i must find the interest rate for my checking account,interest_rate,train-102
will i be charged if i use the card in germany,international_fees,train-103
what is 2 inches in meters,measurement_conversion,train-104
set alarm for 5 am,alarm,train-105
what is the mpg like for this car while driving in the city,mpg,train-106
where can i get a w2 form from,w2,train-107
set a timer for 5 minutes,timer,train-108
set a six minute timer,timer,train-109
send over a hundred dollars from huntington into saving,transfer,train-110
annul the reservation i created,cancel_reservation,train-111
tell me interesting facts about lighthouses,fun_fact,train-112
when am i next having a meeting in december,calendar,train-113
do i have get an oil change on my todo list,todo_list,train-114
can you tell me why my bank account is frozen,account_blocked,train-115
how do i locate my credit score,credit_score,train-116
go ahead and roll those dice,roll_dice,train-117
what is the time frame to get to phoenix,distance,train-118
what's a good place to go to for food around here,restaurant_suggestion,train-119
how do i make lemon merengue pie,recipe,train-120
does the calendar already have easter noted on it,calendar,train-121
change the language you're using to american english,change_language,train-122
what is 10 to the 12th power,calculator,train-123
what's a simple chinese recipe for dinner,meal_suggestion,train-124
do you know the meaning of life,meaning_of_life,train-125
who made this ai,who_made_you,train-126
"if my car battery is dead, what action do i need to do",jump_start,train-127
i need to increase my credit limit,credit_limit_change,train-128
what things are on my shopping list,shopping_list,train-129
i have been spending a lot on insurance lately,spending_history,train-130
is there evening reservations available in the eve,accept_reservations,train-131
can you tell me the exchange rate for yen to euros,exchange_rate,train-132
what's my current credit limit,credit_limit,train-133
yo play that song that go like she take my money,play_music,train-134
i advise you to quit talking,cancel,train-135
please make the pin on my zion bank account to 3232,pin_change,train-136
can you tell me how to set up a direct deposit,direct_deposit,train-137
whats left as far as gas goes,gas,train-138
i need to know how to spell superficial,spelling,train-139
can you cancel,cancel,train-140
list all of my health benefits,insurance,train-141
i lost my luggage coming from chicago on delta flight ab123,lost_luggage,train-142
has my recent order shipped,order_status,train-143
i want you to change the ai name,change_ai_name,train-144
"on a flight with allegiant to orlando, how many carry ons can i take",carry_on,train-145
let lucy know my gps coordinates,share_location,train-146
change the ai name to a new one,change_ai_name,train-147
which timezone is buenos aires in,timezone,train-148
i would love an italian meal suggestion,meal_suggestion,train-149
i wanna add this song to my rock playlist,update_playlist,train-150
can i please know the credit limit for my citibank card,credit_limit,train-151
how much on bills to i have to pay,bill_balance,train-152
what do i do to request a vacation,pto_request,train-153
i want you to call me something else,change_user_name,train-154
how many calories should i plan to be in a donut,calories,train-155
maybe either,maybe,train-156
help me set up direct deposit to my bank of hawaii checking account,direct_deposit,train-157
the location of my phone is unknown to me,find_phone,train-158
do i need vaccinations to travel overseas,vaccines,train-159
set my amex pin to 1234,pin_change,train-160
how do you say i'm hungry in french,translate,train-161
make me giggle,tell_joke,train-162
could you list out the carry-on restrictions for american airlines,carry_on,train-163
when's the next time i should change my tires,tire_change,train-164
tell me when ninety minutes have passed,timer,train-165
please remind me to do this later,reminder_update,train-166
where can i look to learn to make sushi,recipe,train-167
help me get an uber,uber,train-168
where am i right this moment,current_location,train-169
were you born in a hospital,where_are_you_from,train-170
tell me how do i schedule a meeting,schedule_meeting,train-171
what are the total calories for two servings of pasta,calories,train-172
i need a recipe for beef,recipe,train-173
why can't i get into my account,account_blocked,train-174
roll die,roll_dice,train-175
can you give me an overview of what march 23 will look like for me,calendar,train-176
please find the exact payment due date for my sprint phone bill,bill_due,train-177
do i need an international visa to go to brazil,international_visa,train-178
put a stop on my deposit account,freeze_account,train-179
do i have enough in my chase account for a plane ticket,balance,train-180
what's on my meeting schedule today,meeting_schedule,train-181
can i harm my credit if i miss a car payment,improve_credit_score,train-182
i didn't hear say it again please,repeat,train-183
how to locate my credit score,credit_score,train-184
where can i rent a car in boston,car_rental,train-185
how do i move my 401k,rollover_401k,train-186
that is a yes,yes,train-187
i don't know how to change my oil or what type i need,oil_change_how,train-188
can acero take reservation,accept_reservations,train-189
what's the shelf life for eggs in the fridge,food_last,train-190
do i have any appointments on tuesday,calendar,train-191
give me the specifics on my federal taxes,taxes,train-192
what food from italy do you suggest,meal_suggestion,train-193
i need you to confirm that there is a reservation under the name david kramer for 7:00 pm at pietro's,confirm_reservation,train-194
what would the interest rate at wells fargo be,interest_rate,train-195
what timezone is boise in,timezone,train-196
will i need a visa to travel to cancun,international_visa,train-197
add this song to my post-rock playlist,update_playlist,train-198
tell me about the reviews for chilis,restaurant_reviews,train-199
how many miles per gallon am i getting,mpg,train-200
how do i find when my water bill needs to be paid,bill_due,train-201
what's the point balance on my marriot rewards card,rewards_balance,train-202
when do cars need their oil changed,oil_change_when,train-203
what number of vacation days remain for me,pto_balance,train-204
"it was great to see you again, see ya later!",goodbye,train-205
how old are you today,how_old_are_you,train-206
set up direct deposit for me,direct_deposit,train-207
what is the number of points i earned with my mastercard,rewards_balance,train-208
"in bst timezone, what time is it",time,train-209
"i would like to confirm my 7:30 pm reservation at morton's steakhouse, under michael james",confirm_reservation,train-210
can you you confirm my reservation for jean at taco house,confirm_reservation,train-211
what is the proper way to spell diamond,spelling,train-212
find repair shop that will diagnosis dead car battery,jump_start,train-213
i want to cancel my reservation for 5 at red robin,cancel_reservation,train-214
what are the reviews like for bar tartine,restaurant_reviews,train-215
how many points do i have in total on my marriot rewards card,rewards_balance,train-216
i want you to talk more quickly,change_speed,train-217
it could be possible,maybe,train-218
call friend,make_call,train-219
i need to know how much gas is left,gas,train-220
what is the balance on my bank accounts,balance,train-221
i want you to be in whisper mode now because i am in the library,whisper_mode,train-222
tell me the month that my credit card will expire,expiration_date,train-223
please tell me how to ask for a taxi in french,translate,train-224
can i make a reservation at michael's,accept_reservations,train-225
what kinds of things can you do,what_can_i_ask_you,train-226
find what the word diaphanous mean please,definition,train-227
tell me what is on my calendar for may 3,calendar,train-228
"i will be in uruguay from january to august, please let me bank know",travel_notification,train-229
i want a timer for 5 minutes,timer,train-230
what do i have to do on march 2 that's on my calendar,calendar,train-231
how many minutes do i cook baked ziti,cook_time,train-232
what is the fridge life of spahghetti,food_last,train-233
please help me schedule a meeting with john love at 9 am tomorrow,schedule_meeting,train-234
where can i see my credit score,credit_score,train-235
help me get an american express card,new_card,train-236
i wanna add help! by the beatles to my playlist,update_playlist,train-237
i really need to order some more checks for my savings account,order_checks,train-238
"yes, that's accurate",yes,train-239
my transaction history,transactions,train-240
my damage card is not working,damaged_card,train-241
is ice cream currently on my shopping list,shopping_list,train-242
what is an 18 percent tip on 20 dollars,calculator,train-243
how much money do i have coming in each month,income,train-244
is there another person you work for,who_do_you_work_for,train-245
i would like to know my current location,current_location,train-246
put a hault on my savings account,freeze_account,train-247
i need to know if there are transaction fees for my visa card in canada,international_fees,train-248
no idea,maybe,train-249
walk me through the items on my reminder list,reminder,train-250
can you tell me the total cost of my bills please,bill_balance,train-251
show me the transaction on burger king,transactions,train-252
how do i set up direct deposit to my chase account,direct_deposit,train-253
how long is the validity of my credit card,expiration_date,train-254
starbucks near me,directions,train-255
get me an uber to the airport,uber,train-256
please go ahead and increase your speaker volume,change_volume,train-257
what's your age again,how_old_are_you,train-258
what is the limit on my credit,credit_limit,train-259
can you kindly clear my agenda list,todo_list_update,train-260
check if my shopping list has tomato,shopping_list,train-261
"you need to call the melt in lakewood for a table for at 2:00, monday, the first week in march",restaurant_reservation,train-262
"yes, that's affirmative",yes,train-263
let me know how much gas i have,gas,train-264
what is the lowest amount i can pay for my electric bill,min_payment,train-265
what is miami weather like,weather,train-266
find me a rental car from 3/6 - 3/9 in port charles,car_rental,train-267
provide me the number of vacation days i have,pto_balance,train-268
find out what this song is,what_song,train-269
give me some ideas on what i can do in seattle for fun,travel_suggestion,train-270
what is the minimum payment on my phone bill,min_payment,train-271
would you mind switching to whisper mode,whisper_mode,train-272
"i need to report my card as stolen, please",report_lost_card,train-273
does italy have any travel alerts i should be aware of,travel_alert,train-274
how safe is it to travel to mongolia (how safe is mongolia),travel_alert,train-275
whats the predicted weather suppose to be like,weather,train-276
what amount of days off have i already utilized,pto_used,train-277
what are some of the attractions in gatlinburg,travel_suggestion,train-278
please put milk on my list i just used the last of it,shopping_list_update,train-279
what kind of gas does this car need,gas_type,train-280
tell me my shopping list,shopping_list,train-281
who or what association do you work for,who_do_you_work_for,train-282
"can you give me a burmese meal suggestion, please",meal_suggestion,train-283
whisper from here on out please,whisper_mode,train-284
what gas mileage does my car get,mpg,train-285
need the tv on please,smart_home,train-286
check my car's tire pressure,tire_pressure,train-287
i'm on a new job but i need help with my 401k rollover,rollover_401k,train-288
can you text mary and tell them it's ready,text,train-289
"who do i go to, to transfer my 401k",rollover_401k,train-290
how much cash do i earn,income,train-291
make sure april 1 is clear on my calendar,calendar_update,train-292
direct me to the closest starbucks near home,directions,train-293
can you tell me my credit limit,credit_limit,train-294
i need to catch an uber to cal expo,uber,train-295
bloomingdale's declined my card and i'd like to know why,card_declined,train-296
report discover card as lost,report_lost_card,train-297
i need to know my current gps coordinates,current_location,train-298
please tell me what's provided in my health benefits,insurance,train-299
what is the minimum payment i can make on my xcel energy bill,min_payment,train-300
can you tell me some of your hobbies,what_are_your_hobbies,train-301
can you play music by bob dylan,play_music,train-302
could you schedule car maintenance for me,schedule_maintenance,train-303
"is there anything fun to do in manassas, virginia",travel_suggestion,train-304
that is untrue,no,train-305
i believe there's fraud on my card,report_fraud,train-306
so when is my flight landing,flight_status,train-307
can you swap to male voice,change_accent,train-308
is it possible to increase the credit limit for my discover card,credit_limit_change,train-309
do when you when my replacement card will get mailed,replacement_card_duration,train-310
what's the traffic like around the stadium,traffic,train-311
are socket converters necessary in england,plug_type,train-312
do i need a socket converter if i'm going to be in france,plug_type,train-313
how do i get to the leaning tower by bus,directions,train-314
is the sushi well-received at yakamoto,restaurant_reviews,train-315
show me all gas purchases within the last month,transactions,train-316
how many vacation days do i have to spend,pto_balance,train-317
do i have a day off coming up soon,next_holiday,train-318
please make sure oranges are on my shopping list,shopping_list_update,train-319
i'm looking for a roundtrip flight from fwa to hsv for march first to march fifth,book_flight,train-320
tell me what my credit rating is,credit_score,train-321
check my calendar for saturday,calendar,train-322
when is the next day i have off,next_holiday,train-323
what does my to-do list consist of,todo_list,train-324
i wanna know the types of subjects are you familiar with,what_can_i_ask_you,train-325
i dont know,maybe,train-326
"at 9 tomorrow, set off the alarm",alarm,train-327
who tells you what to do,who_do_you_work_for,train-328
are reservations taken at redrobin,accept_reservations,train-329
when should i expect my flight to come in,flight_status,train-330
raise the volume,change_volume,train-331
"how far is the grand canyon from my current location in phoenix, az",distance,train-332
what country were you made,where_are_you_from,train-333
i lost my phone,find_phone,train-334
please check my credit limit on my visa,credit_limit,train-335
help me determine my interest rate,interest_rate,train-336
what day will it be in fourteen days,date,train-337
when's payday,payday,train-338
i made a fraudulent transaction,report_fraud,train-339
how's traffic en route to virginia,traffic,train-340
lock all the doors,smart_home,train-341
make an alarm 6am,alarm,train-342
tell me something funny about people,tell_joke,train-343
can i book a hotel in new york city near times square from 3/1 until 3/5,book_hotel,train-344
switch the language setting over to german,change_language,train-345
is there a way to get a larger limit on my bank of america card,credit_limit_change,train-346
i need to know the items on my shopping list,shopping_list,train-347
look up when my flight is set to start boarding,flight_status,train-348
when should my oil be changed,oil_change_when,train-349
where is there meaning in life,meaning_of_life,train-350
what is the credit card apr please,apr,train-351
"are eggs on my list, if not add them",shopping_list_update,train-352
what is the credit card's apr,apr,train-353
report lost card to discover company,report_lost_card,train-354
check to see if picking up glenn from the airport is on my list of reminders,reminder,train-355
would you add bananas to my shopping list as i am out,shopping_list_update,train-356
how long should i cook the eggs for,cook_time,train-357
where is the w-2 form located,w2,train-358
how are things,greeting,train-359
what is the name of this song,what_song,train-360
can you change the way you talk to a male british voice,change_accent,train-361
please transfer $250 from checking to savings,transfer,train-362
what's the fuel level,gas,train-363
add this song to my jazz playlist,update_playlist,train-364
i got to schedule some car maintenance,schedule_maintenance,train-365
would you tell me a joke,tell_joke,train-366
might you have any hobbies,what_are_your_hobbies,train-367
text josh and tell him i need a delivery,text,train-368
what does kentucky have to offer for things to do,travel_suggestion,train-369
when is my next oil change suggested,oil_change_when,train-370
what is the average time to get to walmart in mays landing,distance,train-371
please tell me the last time i took my car to the shop,last_maintenance,train-372
restore the factory settings,reset_settings,train-373
what type of gas am i allowed to put in this car,gas_type,train-374
flip a coin one time,flip_coin,train-375
how long should i cook a spiral ham,cook_time,train-376
move to the next song,next_song,train-377
do i have any reminders to look up how to properly do a potato in my microwave,reminder,train-378
tell me the nutrition for grapes,nutrition_info,train-379
i'd like to change my pin number for my checking account,pin_change,train-380
can you share the meaning of life,meaning_of_life,train-381
what's the purpose of existence,meaning_of_life,train-382
let cora and nancy know were i am now,share_location,train-383
are there any interesting activities to do in austin,travel_suggestion,train-384
can you just use regular milk instead of buttermilk,ingredient_substitution,train-385
please turn on the alarm,alarm,train-386
can you switch off,cancel,train-387
let me call you fred,change_ai_name,train-388
this was a great conversation,goodbye,train-389
can i swap coconut milk for condensed milk,ingredient_substitution,train-390
you're talking too fast i need you to slow it down,change_speed,train-391
"around nine, is ambrosio busy",how_busy,train-392
"order new checks, please",order_checks,train-393
what is the highway mpg on this car,mpg,train-394
roll dice now,roll_dice,train-395
what health benefits do i have,insurance,train-396
i'd like a block on my charles schwab account immediately,freeze_account,train-397
"ai, tell me what things i should ask of you",what_can_i_ask_you,train-398
please set an alarm for 5 am,alarm,train-399
please speak german to me from now on,change_language,train-400
what funny joke do you know,tell_joke,train-401
what's song am i hearing,what_song,train-402
do i need to read any travel alerts for kenya,travel_alert,train-403
what's the meaning of affiliate,definition,train-404
what am i hearing on the speakers now,what_song,train-405
what's the cheapest fares from lax to sfo for round trip flights leaving april 1st and returning april 7th,book_flight,train-406
what is the definition of my health benefits,insurance,train-407
can you convert millimeters to centimeters,measurement_conversion,train-408
are you my employee,who_do_you_work_for,train-409
what's the meaning of a fortnight,definition,train-410
does macedonia have any travel alerts i should be aware of,travel_alert,train-411
on my chase bank account what is the interest rate,interest_rate,train-412
translate for me hello into french,translate,train-413
what ingredients do i need to make potato skins,ingredients_list,train-414
add this song to my cleaning playlist,update_playlist,train-415
