text,intent,id
how do i direct deposit my check,direct_deposit,train-3635
help me change my pin number,pin_change,train-3636
is the next day off coming up,next_holiday,train-3637
can you tell me some tricks and tips i can use to see an increase in my credit score,improve_credit_score,train-3638
how can i cash in the rewards i earned with my visa card,redeem_rewards,train-3639
tell me where my luggage is,lost_luggage,train-3640
can you be quiet please,cancel,train-3641
what signs should i look for to know if i should change my tires,tire_change,train-3642
please show me how to share my location with noel,share_location,train-3643
i would prefer to hear you speak like a british male,change_accent,train-3644
which song is this,what_song,train-3645
pay my gas bill from my saving account,pay_bill,train-3646
i wish to know my credit limit for my credit card,credit_limit,train-3647
when did i last have a mechanic check out my car,last_maintenance,train-3648
does buffalo wild wings have good reviews,restaurant_reviews,train-3649
where do i find the routing number for wells fargo,routing,train-3650
do i have anything on my schedule for may 3,calendar,train-3651
why was my card declined for my monthly netflix subscription payment,card_declined,train-3652
do you know my credit card's apr,apr,train-3653
hey what's up,greeting,train-3654
i would like you to share with me the nutrition info for chicken nuggets,nutrition_info,train-3655
tell me how much pto i've used,pto_used,train-3656
i arrived on delta flight ab123 from juno but my luggage doesn't appear to have come with me,lost_luggage,train-3657
how long can i leave tuna casserole in the fridge,food_last,train-3658
i need status on that vacation request,pto_request_status,train-3659
what are some funny jokes,tell_joke,train-3660
do i need to get any shots to travel to mexico,vaccines,train-3661
i need to talk to someone about a transaction that was not made by me on my chase account,report_fraud,train-3662
display the routing number for account huntington,routing,train-3663
i need to know what the most recent update is on the status of my online purchase,order_status,train-3664
can i please get the status my order,order_status,train-3665
i need ideas for things to do in nashville,travel_suggestion,train-3666
do you have a name i can use,what_is_your_name,train-3667
i'll talk to you later ai,goodbye,train-3668
help me pay my electric bill,pay_bill,train-3669
is my day off approved,pto_request_status,train-3670
transfer 100 dollars checking to savings,transfer,train-3671
how do i cash the reward for city,redeem_rewards,train-3672
does chillis have good reviews,restaurant_reviews,train-3673
i like this song who is it by,what_song,train-3674
can you update me on my last amazon orders,order_status,train-3675
what is the meaning of altruism,definition,train-3676
is there a better way to check my visa rewards card balance,rewards_balance,train-3677
in my tank how much gas is there,gas,train-3678
did i receive my paycheck this week,payday,train-3679
"where i can use word ""rescind",definition,train-3680
will you please put remember to drop off at the dry cleaner's to my current to do list,todo_list_update,train-3681
i've notified my bank that i'm in mexico from august 1 to august 5,travel_notification,train-3682
what is the projected time frame for the flight to land,flight_status,train-3683
"what time is it in punta gorda, florida",time,train-3684
what's the song they are playing for us right now,what_song,train-3685
i can't answer that,maybe,train-3686
is it okay to substitute oregano for basil,ingredient_substitution,train-3687
can you tell me the amount of gas i have,gas,train-3688
i'm confused about the reason for my bank account being frozen,account_blocked,train-3689
will you please add cannons by phil wickham to my playlist,update_playlist,train-3690
schedule a meeting room for friday at 3pm,schedule_meeting,train-3691
how to build up my credit score,improve_credit_score,train-3692
x is what i am calling you now,change_ai_name,train-3693
can see you see if there are meeting rooms available between 9:00 am and 11:00 am,schedule_meeting,train-3694
i want to increase your volume,change_volume,train-3695
let's go through my to do list items please,todo_list,train-3696
what sort of things can you help me with,what_can_i_ask_you,train-3697
change the speaker volume to a louder one,change_volume,train-3698
how many days do i have left of pto,pto_balance,train-3699
does redrobin do reservations,accept_reservations,train-3700
please find the rules for carry on when flying with spirit airlines,carry_on,train-3701
are there any positive reviews for wendy's,restaurant_reviews,train-3702
what company owns your code,who_made_you,train-3703
i need to know what kind of fuel this car needs,gas_type,train-3704
could you tell me the routing number for my chase checking account,routing,train-3705
please help me find my phone,find_phone,train-3706
what type of plug do i need to bring if i visit japan,plug_type,train-3707
have i have been spending a lot of money on shoes,spending_history,train-3708
roll a pair of dice,roll_dice,train-3709
recommendations for good thai restaurants in las vegas,restaurant_suggestion,train-3710
set an alarm for my meeting and another for my phone call,alarm,train-3711
what are some fun things to do in sweden,travel_suggestion,train-3712
can you tell me the minimum payment of my bill,min_payment,train-3713
i go by the name jim,change_user_name,train-3714
what is my remaining pto days,pto_balance,train-3715
switch my insurance plan to a new one,insurance_change,train-3716
is there a way to tell when i need my oil changed,oil_change_when,train-3717
what is my routing number,routing,train-3718
go to the whisper voice,whisper_mode,train-3719
i need to know the transactions i made on the 10th,transactions,train-3720
how busy is teddy bigger burder around 5,how_busy,train-3721
can you suggest a restaurant for me to eat tonight,restaurant_suggestion,train-3722
how long will my milk be good in the fridge,food_last,train-3723
where am i located currently,current_location,train-3724
it was pleasant having a conversation with you,goodbye,train-3725
"speak more quickly, please",change_speed,train-3726
i don't want to do anything today so just clear the todo list,todo_list_update,train-3727
what name would you like me to call you,what_is_your_name,train-3728
i need to know my rewards balance on my discover card,rewards_balance,train-3729
when did they deposit my last salary,payday,train-3730
good seeing you,goodbye,train-3731
show me my transactions on mcdonalds,transactions,train-3732
what time is my next paycheck coming,payday,train-3733
please do a stop on my bank account,freeze_account,train-3734
tell me when i received my most recent paycheck,payday,train-3735
i need to pay my cable bill,pay_bill,train-3736
my card was not accepted for buying a computer at best buy,card_declined,train-3737
"if i go to olive garden at 4 pm, how busy will it be",how_busy,train-3738
"ai, what's your name",what_is_your_name,train-3739
what is my bank balance for all accounts,balance,train-3740
"buy a flight from santa fe to jacksonville on new year's eve that returns on the fourth, please",book_flight,train-3741
has my credit card application been processed yet,application_status,train-3742
my capital one credit card was stolen,report_lost_card,train-3743
how much have i spent lately on food,spending_history,train-3744
today is what date,date,train-3745
what things do you enjoy doing,what_are_your_hobbies,train-3746
where do i go to find my routing number for southpoint,routing,train-3747
which timezone is colombia,timezone,train-3748
how does my credit score look,credit_score,train-3749
you must tell me your name,what_is_your_name,train-3750
what is 78 times 81 minus 5,calculator,train-3751
"if i want my credit score, how do i find it",credit_score,train-3752
get me italian cuisine dinner suggestions,meal_suggestion,train-3753
can you put a stop on my bank account,freeze_account,train-3754
can you please lower the volume please,whisper_mode,train-3755
"please book a hotel in ny, close to brooklyn, on the 25th to 30th",book_hotel,train-3756
what's the current time now cst,time,train-3757
what makes life have any meaning,meaning_of_life,train-3758
please tell me the name i should use when talking to you,what_is_your_name,train-3759
"the status of my day off request, please",pto_request_status,train-3760
tell me what is on my reminder list,reminder,train-3761
"i can't locate my luggage, i was on jetblue flight ab123 out of detroit",lost_luggage,train-3762
clear my calendar on march 1st,calendar_update,train-3763
someone stole my capital one credit card,report_lost_card,train-3764
please check the door to see who is there,smart_home,train-3765
tell me why my card was declined yesterday,card_declined,train-3766
can you tell me what song i'm hearing,what_song,train-3767
add welcome to the jungle by guns n roses to my playlist,update_playlist,train-3768
please send a text to phil and ask him if he wants to play golf this weekend,text,train-3769
minimum payment of my bill please,min_payment,train-3770
i replaced my tires last year when should i replace my tires again,tire_change,train-3771
i need to transfer ten dollars from my bank of america account to my capital one account,transfer,train-3772
what was that,repeat,train-3773
do a virtual coin flip and tell me if i win as tails,flip_coin,train-3774
"yeah, that's how it is",yes,train-3775
i need to do something about my dead car battery,jump_start,train-3776
"no idea, sorry",maybe,train-3777
why am i unable to access my bank account,account_blocked,train-3778
let's roll some dice,roll_dice,train-3779
remind me tommorow at 3pm i have a doctors appointment,reminder_update,train-3780
i want us to speak to each other in spanish from now on,change_language,train-3781
read me my shopping list please,shopping_list,train-3782
i want to know how nutritious an avocado typically is,nutrition_info,train-3783
move 100 dollars from checking to savings,transfer,train-3784
would you tell me what the status of my day of request is,pto_request_status,train-3785
what's the mpg for the car when it's on the highway,mpg,train-3786
i need a roundtrip flight for 5/2 to 5/8 from nyc to los angeles,book_flight,train-3787
i want you to roll a dice,roll_dice,train-3788
how good are the ratings for chic-fil-a,restaurant_reviews,train-3789
can you play the rock playlist,play_music,train-3790
tell me if you like cats or dogs,do_you_have_pets,train-3791
tell me how much my verizon and comcast bill come to together,bill_balance,train-3792
can you tell me how much cash i have,balance,train-3793
roll the dice!,roll_dice,train-3794
tell me information about my income,income,train-3795
please identify the name of the creator of this ai,who_made_you,train-3796
what name do you know me by,user_name,train-3797
are mashed potatoes good nutrition,nutrition_info,train-3798
please tell me does zeus do reservations,accept_reservations,train-3799
list of countries with travel alerts,travel_alert,train-3800
may i hear some music by fleet foxes,play_music,train-3801
tell me when two minutes are up,timer,train-3802
how long does it take to make shrimp scampi,cook_time,train-3803
i gotta know the meaning of life,meaning_of_life,train-3804
i'd like for their to be a pto request for me made for the dates june 4th to june 8th,pto_request,train-3805
i put some leftover stew in the fridge and want to know how long it'll last,food_last,train-3806
my credit card application has what status,application_status,train-3807
hey do you know how to jump start a car battery,jump_start,train-3808
have i received any messages about my credit card application,application_status,train-3809
how much are my bills,bill_balance,train-3810
how long until my mastercard expires,expiration_date,train-3811
please freeze my bank account,freeze_account,train-3812
what're my wages for the week,income,train-3813
i want to hear you tell a joke,tell_joke,train-3814
i need to know what i have on my shopping list,shopping_list,train-3815
do my task list have call kath on it,todo_list,train-3816
call someone for me,make_call,train-3817
do you want me to shop for peanut butter,shopping_list,train-3818
change the song to the next one,next_song,train-3819
i need to get a new motorcycle insurance plan,insurance_change,train-3820
does delta have carry-on restrictions,carry_on,train-3821
i don't know how to spell anethesia,spelling,train-3822
how does my gas tank look,gas,train-3823
can i increase my credit limit from 1000 to 2000 please,credit_limit_change,train-3824
i'm short on flour so place an order for me,order,train-3825
put buy dog food on my to do list,todo_list_update,train-3826
when did i get my last paycheck,payday,train-3827
that would be true,yes,train-3828
show me the last five transactions,transactions,train-3829
during which month will my card expire,expiration_date,train-3830
what's the nutritional info for a cup of noodle soup,nutrition_info,train-3831
i am obliged to report my stolen card,report_lost_card,train-3832
does this life have a meaning,meaning_of_life,train-3833
start a timer for 10 minutes,timer,train-3834
how busy is ihop generally around noon,how_busy,train-3835
i need you to order all the things on my shopping list,order,train-3836
i need to know the routing number for my checking,routing,train-3837
i need to change my pin number for my checking account,pin_change,train-3838
"could you please tell me, my wells fargo account, is there a hold and why",account_blocked,train-3839
i need to know last months transactions,transactions,train-3840
change your language setting to german,change_language,train-3841
tell me my bank of america routing number,routing,train-3842
tell me about your pets,do_you_have_pets,train-3843
how can i go about finding my current location,current_location,train-3844
do they take reservations at mendy's,accept_reservations,train-3845
it was cool talking with you,goodbye,train-3846
do i have cleaning the counters on my to-do list,todo_list,train-3847
initiate a new alarm please,alarm,train-3848
stop this song and go to the next one,next_song,train-3849
what's next on the list,next_song,train-3850
what might my name be,user_name,train-3851
does my w2 come by mail,w2,train-3852
what ingredients do i need for philly cheesesteaks,ingredients_list,train-3853
can you tell me if i might be able to apply for a new credit card,new_card,train-3854
goodbye for now ai,goodbye,train-3855
are there some good thai restaurants in san antonio,restaurant_suggestion,train-3856
please let me know how long it'll be until i reach the sky harbor airport,distance,train-3857
change to a male voice,change_accent,train-3858
i want your setting adjusted to whisper voice now,whisper_mode,train-3859
i want to know how low the air in my tires are,tire_pressure,train-3860
what is my average mpg in this car,mpg,train-3861
can you find a recipe on how to make chow mein,recipe,train-3862
is there gridlock on the street up to the stadium,traffic,train-3863
what is 750 divided by 5,calculator,train-3864
how much longer until i need an oil change,oil_change_when,train-3865
do my tires seem too low on air,tire_pressure,train-3866
i want to travel this year but i need some suggestions,travel_suggestion,train-3867
how healthy are lunchables,nutrition_info,train-3868
what's my current bank savings,balance,train-3869
pass this song,next_song,train-3870
how do you make pot roast,recipe,train-3871
i would like to try and confirm that i have a reservation at kelly's for moreno,confirm_reservation,train-3872
please tell me if you are an ai,are_you_a_bot,train-3873
can you change your language to japanese,change_language,train-3874
which song is playing,what_song,train-3875
what does life mean to you,meaning_of_life,train-3876
inform me as to the plug type of the country,plug_type,train-3877
"what is 20 ounces in grams, please",measurement_conversion,train-3878
look up instructions for jumper cables,jump_start,train-3879
should i get a vaccination before i go to katmandu,vaccines,train-3880
what hobbies do you like,what_are_your_hobbies,train-3881
please give me the full balance on my water bill,bill_balance,train-3882
how do i locate my routing number for tax reasons,routing,train-3883
put $20000 into my checking account from my savings account,transfer,train-3884
i would like to get an uber to the movies,uber,train-3885
what stuff did i put on my shopping list,shopping_list,train-3886
am i talking with a real person,are_you_a_bot,train-3887
what's 32 degrees fahrenheit in celsisus,measurement_conversion,train-3888
help me change my oil and what kind do i need,oil_change_how,train-3889
what are some steps to building my credit score,improve_credit_score,train-3890
what's a good joke,tell_joke,train-3891
let's hear my workout playlist,play_music,train-3892
"about something,tell me some trivia",fun_fact,train-3893
how low is the pressure in my tires,tire_pressure,train-3894
is there another company you work for,who_do_you_work_for,train-3895
who is knocking,smart_home,train-3896
is a meeting with ruth on my schedule today,meeting_schedule,train-3897
get a hold of sue,make_call,train-3898
what type of fuel does my car need,gas_type,train-3899
"my name is stu, not sue!",change_user_name,train-3900
i want to learn the process of changing oil,oil_change_how,train-3901
it was good chatting,goodbye,train-3902
change to female voice,change_accent,train-3903
unsync my phone,sync_device,train-3904
how many miles can i drive before needing the next oil change,oil_change_when,train-3905
i'd like a new alarm set for 6am,alarm,train-3906
what's the temperature like in tampa,weather,train-3907
i jot got hired and need help with my retirement account,rollover_401k,train-3908
make me a reminder that tommorow is trash day,reminder_update,train-3909
what's your place of manufacture,where_are_you_from,train-3910
can you locate my phone,find_phone,train-3911
put dr feelgood by motley crue on my playlist,update_playlist,train-3912
i wanna know when my meeting is with dan,meeting_schedule,train-3913
i need to see my shopping transactions,transactions,train-3914
how bad is city traffic in miami on friday's at 5 pm,traffic,train-3915
when would you recommend i get my oil changed,oil_change_when,train-3916
who is your manager,who_do_you_work_for,train-3917
please add sugar to my shopping list if it's not on it,shopping_list_update,train-3918
whats 5 feet in inches,measurement_conversion,train-3919
"i'll be out of the country soon, and want to notify my bank",travel_notification,train-3920
please make sure my account is frozen,freeze_account,train-3921
i want all the things on the shopping list,order,train-3922
"could you freeze my account, please",freeze_account,train-3923
i need to know why my card declined yesterday,card_declined,train-3924
move $40 from account b to account a,transfer,train-3925
"what is the distance to austin city limits from my hotel , the holiday inn at austin",distance,train-3926
get me a room in cali on november 11 to 15,book_hotel,train-3927
can you tell me the meaning of life,meaning_of_life,train-3928
i need to get a flight out of tampa to chicago in a month for under $123,book_flight,train-3929
make a pto request from april 2 to april 4,pto_request,train-3930
how do i get direct deposit set up,direct_deposit,train-3931
make your speech slower than now,change_speed,train-3932
what kind of gas does this car take,gas_type,train-3933
what can harm my credit score,improve_credit_score,train-3934
how much have i paid for rent in the last 6 months,spending_history,train-3935
take it easy!,goodbye,train-3936
go to the next tune,next_song,train-3937
confirm my taco house reservation for jean,confirm_reservation,train-3938
my card is to be reported stolen,report_lost_card,train-3939
what is the amount i have spent on food recently,spending_history,train-3940
i want to set your name to gaffigan,change_ai_name,train-3941
i'm out of toothpaste so will you order me some more,order,train-3942
pull up ways to lower credit score,improve_credit_score,train-3943
how do you convert pounds to kilos,measurement_conversion,train-3944
whats euros kroner in 25,exchange_rate,train-3945
how many days off for vacation do i have left,pto_balance,train-3946
what is 10000 divided by 20,calculator,train-3947
please report information about activity on my credit card,report_fraud,train-3948
please read my todo list,todo_list,train-3949
swap my amex pin to 1234,pin_change,train-3950
what is your perception of the meaning of life,meaning_of_life,train-3951
i need to know my income,income,train-3952
how much is left of mastercard,balance,train-3953
go shopping and order everything on the list,order,train-3954
tell me your age please,how_old_are_you,train-3955
what is needed you to cook apple pie,recipe,train-3956
can you roll a 4 sided dice,roll_dice,train-3957
what's the current amount of vacation owed to me,pto_balance,train-3958
i can't change my oil and don't know what kind i need,oil_change_how,train-3959
i want for you to connect to my phone,sync_device,train-3960
how many inches are in 5 feet,measurement_conversion,train-3961
can you tell me where the nearest rest station to me is,directions,train-3962
can yogurt be used for sour cream,ingredient_substitution,train-3963
set a five minute timer,timer,train-3964
what is the credit limit for my bank of america card,credit_limit,train-3965
"my luggage is lost, i was on american airlines ab123 out of los angeles",lost_luggage,train-3966
create a reminder for me to send flowers to my mom for mother's day,reminder_update,train-3967
please dial david now,make_call,train-3968
tell me the status of my tires and when i need to replace them,tire_change,train-3969
please reset the factory settings,reset_settings,train-3970
favorite what's currently playing on my playlist,update_playlist,train-3971
"looking at january, show all wine purchases",transactions,train-3972
i need you to roll dice now,roll_dice,train-3973
it is definitely affirmative,yes,train-3974
please remove fishing from my calendar for soccer,calendar_update,train-3975
my card is not working and i need to let them know,damaged_card,train-3976
alert the wife of my exact location,share_location,train-3977
i recently took a new job and need help with my 401k rollover,rollover_401k,train-3978
set reminder to prepare for my meeting at 10 am,reminder_update,train-3979
let me see the reminder list please,reminder,train-3980
flip that coin please,flip_coin,train-3981
i want to put you in a different language,change_language,train-3982
when do i need to pay the cable bill,bill_due,train-3983
how do you spell out newspaper,spelling,train-3984
how much money do i have in checking,balance,train-3985
am i talking to a real person,are_you_a_bot,train-3986
what's the way to make apple pie,recipe,train-3987
can someone look at my car cause the check engine light is on,schedule_maintenance,train-3988
help me apply for an american express card,new_card,train-3989
can you tell me what reminders i've set,reminder,train-3990
my capital one account has a hold; why,account_blocked,train-3991
i want a new motorcycle insurance plan,insurance_change,train-3992
that is wrong,no,train-3993
i'd like to know the apr on my visa card,apr,train-3994
what is the best interest rate i can get from now on,interest_rate,train-3995
what are my gps coordinates at this location,current_location,train-3996
am i talking to an actual person,are_you_a_bot,train-3997
i need to know if i have reservations at arufflo at 5 pm,confirm_reservation,train-3998
i want to hear the very next song on this playlist,next_song,train-3999
i want my account frozen,freeze_account,train-4000
please tell me what the mpg is for this car,mpg,train-4001
does mexico require me to have a visa to travel there,international_visa,train-4002
please suggest a meal from italy to me,meal_suggestion,train-4003
can you please add take out recycling on my list of chores to complete,todo_list_update,train-4004
roll a 6 sided dice for me,roll_dice,train-4005
how many days did i skip work,pto_used,train-4006
i want you to recommend a good local restaurant to me,restaurant_suggestion,train-4007
call hr so i can figure out how many days off i've taken,pto_used,train-4008
what are the most popular attractions in gatlinburg,travel_suggestion,train-4009
my tires need to be changed when,tire_change,train-4010
i need to rollover my 401k because i got a new job,rollover_401k,train-4011
how do i do an oil change and what type do i use,oil_change_how,train-4012
can you speak slower please,change_speed,train-4013
what plug type should i use in england,plug_type,train-4014
madison to atlanta delta ticket,book_flight,train-4015
how do i start my car battery,jump_start,train-4016
my card didn't go through when i was buying a case of water at walmart,card_declined,train-4017
thank ya!,thank_you,train-4018
pull up my grocery transactions,transactions,train-4019
can you tell me the calorie count in a glazed donut,calories,train-4020
why is my account blocked,account_blocked,train-4021
how many days until my next day off,next_holiday,train-4022
it might be either one,maybe,train-4023
"from here, how do i get to the statue of liberty by bus",directions,train-4024
continue to next song on the playlist,next_song,train-4025
i need my todo list read,todo_list,train-4026
i had fun speaking with you,goodbye,train-4027
what's the number of calories in a pepsi,calories,train-4028
i want to know if my application for a credit card at community bank has been approved or not,application_status,train-4029
add clean bathroom to my to do list,todo_list_update,train-4030
can you make a phone call to randy,make_call,train-4031
what's an interesting fact about flamingos,fun_fact,train-4032
