text,intent,id
thanks a lot,thank_you,train-11212
i would love it if you could put a stop on my bank account,freeze_account,train-11213
what are some good restaurants in chicago,travel_suggestion,train-11214
can you find me a roundtrip flight from orlando to austin for 3/28 to 4/5,book_flight,train-11215
"what kinds of oil can i use in my car, and how to i change the oil",oil_change_how,train-11216
can you tell me when my electric bill is due,bill_due,train-11217
read my list of reminders to me,reminder,train-11218
what location can i get a w2 from,w2,train-11219
what's the nutritional info for french fries,nutrition_info,train-11220
can you tell me my name,user_name,train-11221
i want to know how do i schedule a meeting,schedule_meeting,train-11222
help me get an uber to ann arbor,uber,train-11223
is pizza considered healthy,nutrition_info,train-11224
"what, if any, are the charges for using my card in mexico",international_fees,train-11225
i need to know how much i make at my job,income,train-11226
i want to know whether or not you are a pet owner,do_you_have_pets,train-11227
what do you do for hobbies,what_are_your_hobbies,train-11228
will i need a socket converter when i go to france,plug_type,train-11229
is new this a good insurance plan for me,insurance_change,train-11230
whats the update on flight dl123,flight_status,train-11231
give me the meaning of alternative,definition,train-11232
"tell me about traffic conditions in ocean city, nj on sunday mornings around 10 am in the summer",traffic,train-11233
how are the tires on air pressure,tire_pressure,train-11234
what's the best way to jump start a kia,jump_start,train-11235
what is my salary right now,income,train-11236
please be quiet,cancel,train-11237
call my mother,make_call,train-11238
when will i get my next paycheck,payday,train-11239
does delta allow more than one carry on when traveling to miami,carry_on,train-11240
get an uber to take me to my brother's house in mineola,uber,train-11241
would you let me know how many carry ons i can take on a flight with southwest airlines to miami,carry_on,train-11242
assist me to know how to get to target by bus,directions,train-11243
"sorry, that is not true",no,train-11244
what kinds of fun touristy things are there to do in boston,travel_suggestion,train-11245
tell me where a w2 is available please,w2,train-11246
how soon will me package arrive,order_status,train-11247
what is you name,what_is_your_name,train-11248
can you get me a table for two for 8:00 pm at parc,restaurant_reservation,train-11249
can i increase the credit limit for my navy federal card,credit_limit_change,train-11250
could you insert broken by evanescence to my music,update_playlist,train-11251
i would love to hear a joke about the dmv,tell_joke,train-11252
how long's it been since i had my car serviced,last_maintenance,train-11253
i want to pay that bill now,pay_bill,train-11254
where can i go to see if my credit card application has been processed,application_status,train-11255
can you tell me what song this is,what_song,train-11256
can you tell me how much pto i still have,pto_balance,train-11257
uh-huh,yes,train-11258
can you remember who compiled you,who_made_you,train-11259
how many culver's take reservations,accept_reservations,train-11260
please change your accent to the male british one,change_accent,train-11261
send $20 from debit to steve's account,transfer,train-11262
how long does bread last,food_last,train-11263
i'm going to need a hotel room for 8 people in tallahassee from 3/10 until 3/12,book_hotel,train-11264
i think my card is stolen and needs to be reported,report_lost_card,train-11265
i don't know who to notify that i ran my credit card over with the lawn mower,damaged_card,train-11266
i can't seem to find my phone,find_phone,train-11267
write text and send to someone,text,train-11268
how many carry ons can i take on a flight with jet blue to washington dc,carry_on,train-11269
shoot the dice!,roll_dice,train-11270
tell me a joke about baseball,tell_joke,train-11271
"i creased my card today, contact the bank",damaged_card,train-11272
is there traffic on my way to work today,traffic,train-11273
can you cancel my dinner reservation,cancel_reservation,train-11274
i want a new pin for my savings account,pin_change,train-11275
tell me how to make chow mein,recipe,train-11276
explain to me how transferring my 401k works,rollover_401k,train-11277
how good are the ratings for outback,restaurant_reviews,train-11278
i need you to increase your volume,change_volume,train-11279
where did you used to live,where_are_you_from,train-11280
how many meters are in 10 millimeters,measurement_conversion,train-11281
"could you tell me what 30% off 235 is, please",calculator,train-11282
what can i do in evans,travel_suggestion,train-11283
use my phone and connect please,sync_device,train-11284
have i scheduled anything on march 2nd on my calendar,calendar,train-11285
when will i recieve another paycheck,payday,train-11286
how much longer until i have to change my tires,tire_change,train-11287
will you tell me who made the ai,who_made_you,train-11288
make a reminder to work out at the gym,reminder_update,train-11289
i did not hear you,repeat,train-11290
"ai, stop!",cancel,train-11291
what would be a fun fact about cats,fun_fact,train-11292
what do my federal taxes amount to,taxes,train-11293
tootles,goodbye,train-11294
set reminder pay taxes on monday,reminder_update,train-11295
i'm not sure which it is,maybe,train-11296
view my transactions for the last week,transactions,train-11297
what amount do my state taxes look like,taxes,train-11298
i must pay my cable bill from my checking account,pay_bill,train-11299
are you a real person or a robot,are_you_a_bot,train-11300
take lunch with steven off of my calendar,calendar_update,train-11301
book a reservation for 4 at outback steakhouse under the name dave,restaurant_reservation,train-11302
what gas does this car need,gas_type,train-11303
can you help me solve a math problem,calculator,train-11304
i need an uber to times square asap,uber,train-11305
why is there a block on my account,account_blocked,train-11306
i want that volume bumped up to 4,change_volume,train-11307
where were you given birth,where_are_you_from,train-11308
please call me by this new name,change_user_name,train-11309
could you slow down your speech,change_speed,train-11310
what is 15% of 3143,calculator,train-11311
how many rooms are available between 2 and 3,schedule_meeting,train-11312
set a four minute timer,timer,train-11313
can you tell me when my credit card application will be processed,application_status,train-11314
on what day and date of what year were you born,how_old_are_you,train-11315
what are the steps for setting up direct deposit,direct_deposit,train-11316
what would you like to call me,user_name,train-11317
i need you to push my location to cory,share_location,train-11318
tell me that status of flight dl123,flight_status,train-11319
what's the nearest ups store to walmart,directions,train-11320
how much is the charge of using my card in italy during my stay there,international_fees,train-11321
where can i find my credit score,credit_score,train-11322
whats the title of this song,what_song,train-11323
text roderick and tell him im running late,text,train-11324
how much did i spend on lunches last week,spending_history,train-11325
what are your capabilities,what_can_i_ask_you,train-11326
what the heck is qat,definition,train-11327
what is the process for ordering new checks,order_checks,train-11328
take pat's appointment off my calendar,calendar_update,train-11329
can you find a keto friendly restaurant,restaurant_suggestion,train-11330
i would like to add you say by lauren daigle to my playlist,update_playlist,train-11331
please run a timer for me,timer,train-11332
how many miles until i get to the beach,distance,train-11333
how much money have i spent on groceries recently,spending_history,train-11334
thank you for answering that,thank_you,train-11335
pay my cable bill from my checking account,pay_bill,train-11336
can you tell me the routing number for my chase checking,routing,train-11337
what's the minimum payment on my phone bill,min_payment,train-11338
im leaving-goodbye!,goodbye,train-11339
tell me a fun trivia bit about artificial intelligence,fun_fact,train-11340
"for the shopping list, add ham as well",shopping_list_update,train-11341
start a new text,text,train-11342
can you tell me my minimum due for citicard,min_payment,train-11343
please connect with my phone,sync_device,train-11344
help me get a meeting set up,schedule_meeting,train-11345
how many points did my visa earn,rewards_balance,train-11346
tell me how many vacation days i have,pto_balance,train-11347
can you check on the status of my orders at amazon,order_status,train-11348
mark down that i will be in rome from february 1 to march 1 and notify my bank,travel_notification,train-11349
help me check my visa rewards card,rewards_balance,train-11350
when do i have to change oil,oil_change_when,train-11351
yesterday what did i spend on lunch,spending_history,train-11352
tell me your age,how_old_are_you,train-11353
please submit an order for new checks on my pnc money market account,order_checks,train-11354
can i change your name to buttercup,change_ai_name,train-11355
how can i set up a direct deposit with my checking account,direct_deposit,train-11356
how is it possible that my account has been frozen,account_blocked,train-11357
i wanna know the status of flight dl123,flight_status,train-11358
what are the steps to set up direct deposit to my chase account,direct_deposit,train-11359
can you speak to me using japanese,change_language,train-11360
how good are the ratings for the french laundry,restaurant_reviews,train-11361
what are fun facts about lighthouses,fun_fact,train-11362
remove laundry from my todo list,todo_list_update,train-11363
what do i have on my calendar for february 8,calendar,train-11364
i need to be reminded to pray,reminder_update,train-11365
i wish to know the gas i need to fill this car up with,gas_type,train-11366
are you a machine,are_you_a_bot,train-11367
you're talking too quickly for me to understand,change_speed,train-11368
please turn on whisper mode because i am about to be in class,whisper_mode,train-11369
"i did not hear you, please repeat",repeat,train-11370
tell me how to check rewards for my mastercard,rewards_balance,train-11371
thanks for the help,thank_you,train-11372
are there instructions on how to make buttermilk pancakes,recipe,train-11373
what's the count of vacation days i have left,pto_balance,train-11374
pair with my phone,sync_device,train-11375
what is the full date after today,date,train-11376
there has been fraudulent activity on my card and i need to report it,report_fraud,train-11377
can you confirm my reservation for 6 at the outback,confirm_reservation,train-11378
can you tell me how to figure out my current location,current_location,train-11379
what is my current credit score,credit_score,train-11380
i want to see the golden gate bridge and i'm walking on 5th street right now,directions,train-11381
can you speak to me in chinese,change_language,train-11382
how should i prepare to change my own oil,oil_change_how,train-11383
i lost my chase bank card and want it labeled as lost,report_lost_card,train-11384
do you know if my vacation request has been approved,pto_request_status,train-11385
how many tablespoons are in three cups,measurement_conversion,train-11386
can you tell me what to do as i am in the airport and have been for some time and there is still no sign of my suitcase,lost_luggage,train-11387
does spain expect any travel alerts,travel_alert,train-11388
i want to put in a pto request for march 1-8,pto_request,train-11389
when's my next payday,payday,train-11390
add cleaning to my to do list,todo_list_update,train-11391
give me the traffic at lexington,traffic,train-11392
what is the temperature on the ac,smart_home,train-11393
that appears true,yes,train-11394
"spell ""requisite"" for me",spelling,train-11395
what is the exchange rate for canadian dollars to us dollars,exchange_rate,train-11396
lock every door on the property,smart_home,train-11397
"from here, i take this bus to go to brooklyn and how long is the commute",distance,train-11398
thanks for that,thank_you,train-11399
what's something interesting to do kentucky,travel_suggestion,train-11400
i don't have a clue,maybe,train-11401
what's the current reward amount on my visa,rewards_balance,train-11402
what's the due date for the credit card,bill_due,train-11403
can you take carrots off my shopping list and add soda,shopping_list_update,train-11404
how do i get direct deposit for my paycheck,direct_deposit,train-11405
whats included with my insurance,insurance,train-11406
provide me the routing number for my fed account,routing,train-11407
i'll need a rental car from 3/3 - 3/14 in vegas,car_rental,train-11408
send the location i'm at with martin,share_location,train-11409
mind connecting to my phone,sync_device,train-11410
how is the traffic on my way to the venue,traffic,train-11411
how do i locate when my gas bill is do,bill_due,train-11412
could you pull up my location on the map,current_location,train-11413
how many days so far have i taken off,pto_used,train-11414
what are my insurance rewards,insurance,train-11415
add my doctor appointment on march 25th at 3:00 to my calendar,calendar_update,train-11416
what's the amount of money i spent yesterday,spending_history,train-11417
how can i take a bus to dallas,directions,train-11418
how long before my lawn guy bill's due,bill_due,train-11419
i have to get going,goodbye,train-11420
what are the reviews for mountain mikes,restaurant_reviews,train-11421
please cancel the input,cancel,train-11422
pause,cancel,train-11423
can you locate me on a map,current_location,train-11424
where do i go the transfer my 401k,rollover_401k,train-11425
throw the dice,roll_dice,train-11426
search for any travel alerts for canada,travel_alert,train-11427
tell me about any travel alerts issued for germany,travel_alert,train-11428
check the wait time for macaroni grill,how_busy,train-11429
will qdoba take reservations,accept_reservations,train-11430
i spent what dollar amount last month on mastercard,transactions,train-11431
do i have brush my teeth on my todo list,todo_list,train-11432
how much money is in my checking account,balance,train-11433
you are how old now,how_old_are_you,train-11434
"in making an omelette, what ingredients do i need",ingredients_list,train-11435
how much do i pay in tax,taxes,train-11436
in england how do they say subway,translate,train-11437
what all is in gumbo,ingredients_list,train-11438
i want to switch my insurance coverage,insurance_change,train-11439
text my friend for me and tell them to meet me later,text,train-11440
what is intercontinental mean,definition,train-11441
i need an alarm to go off tomorrow at five fifteen,alarm,train-11442
help me to know what song is playing,what_song,train-11443
is crushed garlic the same as powdered garlic for a spaghetti sauce,ingredient_substitution,train-11444
is the tofu i put in the fridge tuesday still edible today,food_last,train-11445
do you know whether ihop does reservations,accept_reservations,train-11446
what's the nutritional information of iceberg lettuce,nutrition_info,train-11447
i want volume set to 4,change_volume,train-11448
how many personal days have i taken this month,pto_used,train-11449
is there a room big enough for 10 people from monday to tuesday in manhattan,book_hotel,train-11450
i appreciate that answer,thank_you,train-11451
my last card was stolen and i want to know how long until i get my new one,replacement_card_duration,train-11452
are my tires low,tire_pressure,train-11453
i'd like to know how much gas is left,gas,train-11454
how long do i've got until my discovery card expires,expiration_date,train-11455
repeat the question,repeat,train-11456
help me find my cellphone,find_phone,train-11457
is there enough fuel to drive to tampa,gas,train-11458
i need a 401k rolled over to my brand new job,rollover_401k,train-11459
would you like to introduce yourself,what_is_your_name,train-11460
how long is an oil change good for,oil_change_when,train-11461
what is the apr on my chase freedom card,apr,train-11462
who do you work for,who_do_you_work_for,train-11463
what ingredients are in chips,ingredients_list,train-11464
help me figure out the meaning of life,meaning_of_life,train-11465
what's the amount of time off i've had,pto_used,train-11466
can you get the fan going in here,smart_home,train-11467
can you report my lost discover card,report_lost_card,train-11468
i cant recall my pin number for my city first account,pin_change,train-11469
where's my luggage for american airlines flight ab123 out of denver,lost_luggage,train-11470
do i have anything on my todo list about shoveling snow,todo_list,train-11471
the pets are all good,do_you_have_pets,train-11472
can you call a taxi,make_call,train-11473
how long can i keep fish in the freezer before it gets ruined,food_last,train-11474
"i want to hear the song that has, ""baby shark, doo doo",play_music,train-11475
how can i figure out the interest rate for my columbia account,interest_rate,train-11476
what is the amount of my federal taxes,taxes,train-11477
how good is the apr on my credit card,apr,train-11478
"i ordered some curtains off amazon, can you tell me if it's been shipped yet",order_status,train-11479
let me know how to get to the starbucks nearby,directions,train-11480
clear my calendar for this friday,calendar_update,train-11481
let me bank know i will be in brazil from june 1st to july 1st,travel_notification,train-11482
who do you take orders from,who_do_you_work_for,train-11483
is it safe to travel to argentina,travel_alert,train-11484
can you find a good steakhouse for tonight,restaurant_suggestion,train-11485
i think you are a bot,are_you_a_bot,train-11486
i need to take out the trash please remind me,reminder_update,train-11487
have i used half of my days off yet,pto_used,train-11488
get everything on my shopping list,order,train-11489
how much gas does this use in the city,mpg,train-11490
clue me in on my credit score,credit_score,train-11491
timer for 5 minutes,timer,train-11492
what do i need to set up direct deposit,direct_deposit,train-11493
where is my phone now,find_phone,train-11494
tell me united's carry on policy,carry_on,train-11495
what do you use when you make a chef's salad,ingredients_list,train-11496
can you talk at a normal speed please,change_speed,train-11497
how much longer until my credit card application is checked,application_status,train-11498
block my chase account asap,freeze_account,train-11499
can you mail more checkbooks to me please,order_checks,train-11500
can you find me a hotel in columbus with good reviews,book_hotel,train-11501
will i need a visa to go to moldova,international_visa,train-11502
how many miles before i need my tires changed,tire_change,train-11503
how expensive was my most recent transaction,transactions,train-11504
can you explain to me how i ought to use my credit card points,redeem_rewards,train-11505
what is 15 ounces in grams,measurement_conversion,train-11506
what type of restaurants are nearby,restaurant_suggestion,train-11507
can you give me a thai meal suggestion,meal_suggestion,train-11508
to vacation to tel aviv do i need a travel visa,international_visa,train-11509
"can you check to see if my order has been delivered, please",order_status,train-11510
could you make a flight reservation with air emirates from orlando to london,book_flight,train-11511
when do my tires need to be changed again,tire_change,train-11512
can i maybe apply for a new card,new_card,train-11513
can you change my 1st national account pin to 4892,pin_change,train-11514
can you tell me what day my next paycheck will come,payday,train-11515
how could i say twin in chinese,translate,train-11516
please look up my card's expiration date,expiration_date,train-11517
i dunno,maybe,train-11518
can i take a bus to the grand canyon,directions,train-11519
where do i get the form that shows my wages for the year for taxes,w2,train-11520
i need the new due date for my pgw gas bill,bill_due,train-11521
can i convert my credit card points to milage,redeem_rewards,train-11522
do you have an employer,who_do_you_work_for,train-11523
what's the max time i can leave a green pepper in the fridge,food_last,train-11524
can you go to the whisper voice,whisper_mode,train-11525
i must call dr smith,make_call,train-11526
i didn't hear what you said,repeat,train-11527
is the traffic bad on the way to work,traffic,train-11528
will i be charged extra for using my card in spain,international_fees,train-11529
is this a person talking to me or a computer,are_you_a_bot,train-11530
how many carry ons can i take on a flight with american airlines to seattle,carry_on,train-11531
what are your best travel suggestions,travel_suggestion,train-11532
where do people go to eat in this town,restaurant_suggestion,train-11533
i wanted to remember what again,reminder,train-11534
use the male voice please,change_accent,train-11535
adjust your language setting to english,change_language,train-11536
can you please dim the lights,smart_home,train-11537
talk to me by calling me this name from now on,change_user_name,train-11538
what sort of fuel does this car take,gas_type,train-11539
can i change my nickname,change_user_name,train-11540
i need your assistance on rolling over my 401k,rollover_401k,train-11541
are there any new travel warnings for the us,travel_alert,train-11542
no that's wrong,no,train-11543
what is your place of origin,where_are_you_from,train-11544
schedule an uber to the bean,uber,train-11545
how many years do you have,how_old_are_you,train-11546
what is the air pressure in my tires,tire_pressure,train-11547
can you please locate my phone,find_phone,train-11548
shhhh,cancel,train-11549
i can't find my student id card and i want to report it as lost,report_lost_card,train-11550
how much to i have left on my visa card limit,credit_limit,train-11551
assist me to set up direct deposit,direct_deposit,train-11552
find instructions for how to change the oil in a 2015 passat,oil_change_how,train-11553
"hmmm, either could be a choice",maybe,train-11554
when can i expect to receive the order,order_status,train-11555
what ingredients do i need for gumbo,ingredients_list,train-11556
make a reservation for 2 at red lobster at 8pm,restaurant_reservation,train-11557
good day,greeting,train-11558
please check the status of my mastercard application,application_status,train-11559
so do you like cats or dogs,do_you_have_pets,train-11560
inform me on the directions to jump start my car,jump_start,train-11561
create a new text,text,train-11562
tell me the visa card credit limit,credit_limit,train-11563
how do i jump start the car,jump_start,train-11564
could i use white wine instead of red wine in a recipe,ingredient_substitution,train-11565
how can i travel by bus to the grand canyon,directions,train-11566
how long until i can expect my new card to get mailed to me,replacement_card_duration,train-11567
how many dollars is one mexican peso,exchange_rate,train-11568
abort please,cancel,train-11569
whats the status of my delta flight,flight_status,train-11570
please tell me how to change the oil in my car,oil_change_how,train-11571
miami time zone is what,timezone,train-11572
what company wrote your code,who_made_you,train-11573
give me expected number of calories in a breakfast burrito,calories,train-11574
quiet now,cancel,train-11575
when was my most recent transaction,transactions,train-11576
how do i slow down my ai's voice,change_speed,train-11577
how's the weather in tallahassee,weather,train-11578
what is the temperature in costa mesa,weather,train-11579
check to see if i have any meetings with peter today,meeting_schedule,train-11580
see ya,goodbye,train-11581
what is the meaning of this life,meaning_of_life,train-11582
goodbye to you,goodbye,train-11583
what is the time in the utc timezone,time,train-11584
start a new text to maureen and tell her i go mom's christmas present,text,train-11585
please make a pto request from dates september 1 to 15,pto_request,train-11586
i need to know my spending limit on my visa,credit_limit,train-11587
i want to talk to sarah,make_call,train-11588
can i exchange milk for cream in recipes,ingredient_substitution,train-11589
did i put unpacking groceries on my to do list,todo_list,train-11590
put in a pto request for me i want it for the ninth and the tenth of august,pto_request,train-11591
what's your country of origin,where_are_you_from,train-11592
what meaning does life hold,meaning_of_life,train-11593
do a coin flip,flip_coin,train-11594
would you let me know how low the air in my tires are,tire_pressure,train-11595
do they take reservations at olive garden,accept_reservations,train-11596
yep,yes,train-11597
tell me how many meetings with pete i have for today,meeting_schedule,train-11598
should i put air in my tires,tire_pressure,train-11599
tell when should i get my tires changed next,tire_change,train-11600
can you tell me how to change the oil in my car,oil_change_how,train-11601
what created you,who_made_you,train-11602
how do i make my insurance policy different,insurance_change,train-11603
what benefits are provided by my insurance,insurance,train-11604
i would like to know what today's date is,date,train-11605
will using a different type of gas matter for this car,gas_type,train-11606
"my water bill is due, pay it immediately",pay_bill,train-11607
i need to know what kinds of pets you have,do_you_have_pets,train-11608
what is the protocol for modifying my insurance policy,insurance_change,train-11609
does bank of america charge transaction fees if you use it in canada,international_fees,train-11610
yo,greeting,train-11611
